{
  "audit": {
    "audit_date": "2026-07-31",
    "audited_main_sha": "2fd50b9c72f80d7f0f6eb928cb61035e51a78fd3",
    "limitations": [
      "A conversation report is not independent artifact custody.",
      "External media-rich packs are not in the repository unless a manifest says otherwise.",
      "This ledger records the audited state; a later merge requires a new ledger revision rather than mutating history silently."
    ],
    "method": [
      "reviewed pull requests 1 through 52 and their stated scope",
      "verified ancestry for stacked and cumulative heads against audited main where exact heads were available",
      "compared preserved non-main branch heads to audited main",
      "reconciled source-free specimen manifests and proof receipts",
      "retained conversation-only claims as explicitly unbound reports rather than silently dropping or promoting them"
    ],
    "pending_pull_requests": [
      {
        "head_sha": "a1babd796e6ea87aa9f6489c6d589540337248d6",
        "pr": 52,
        "status": "green_mergeable_not_merged"
      }
    ],
    "repository": "BigBirdReturns/earcrate"
  },
  "claim_corrections": [
    {
      "claim_id": "correction.production_cleanup_complete",
      "previous_claim": "The repository had completed PEP 517/621 wheel productionization and a clean production cutover.",
      "reason": "The production-cleanup bootstrap never produced its declared tree; audited main does not establish the claimed wheel/distribution work.",
      "retained_obligation": "Create a conventional packaging PR from current main if installable wheel distribution remains desired.",
      "status": "retracted"
    },
    {
      "claim_id": "correction.governance_v2_already_complete",
      "pending_ref": {
        "head_sha": "a1babd796e6ea87aa9f6489c6d589540337248d6",
        "pr": 52
      },
      "previous_claim": "PR #49/main fully enforced committed per-reviewer blinding, arbitration, scoped rights, format-neutral atomic publication, and PublicationReceipt.",
      "reason": "Audited main documentation was ahead of implementation. PR #52 implements the missing contract and is green but not yet merged.",
      "status": "corrected_by_pending_pr"
    },
    {
      "claim_id": "correction.download_links_are_custody",
      "previous_claim": "A previously emitted sandbox download link implied durable evidence.",
      "reason": "Session storage is ephemeral and several past links disappeared.",
      "retained_rule": "Only exact identities in durable manifests/receipts or a verified evidence store establish custody.",
      "status": "retracted_as_general_rule"
    },
    {
      "claim_id": "correction.organ_success_equals_whole_buffalo",
      "previous_claim": "A strong score, recurrence, MIDI, rack, or transport demonstration could be described as the complete organism.",
      "reason": "Buffalo Gate separates organ passage from whole-organism passage and records blocked organs explicitly.",
      "status": "retired_interpretation"
    }
  ],
  "external_evidence": [
    {
      "evidence_id": "children.authoritative_score_pdf",
      "evidence_tier": "authoritative_score",
      "expected_sha256": "e029e1a3030800d7fb04c9f5163acb9270579a571d57f63eb63787df692d5845",
      "main_refs": [
        "specimens/children_v1.json",
        "proofs/specimens/children_v1.score-side.proof.json"
      ],
      "retained_claims": [
        "130 BPM",
        "4/4",
        "four-flat key signature",
        "printed repeats and alternate endings",
        "Segno",
        "To Coda",
        "D.S. al Coda",
        "printed chord vocabulary"
      ],
      "status": "external_evidence_bound_by_identity",
      "title": "Children authored score evidence",
      "why_not_main": "Score media remains external by rights and repository policy."
    },
    {
      "evidence_id": "children.cross_organ_score_pack",
      "evidence_tier": "authoritative_score_and_performance_realization",
      "identities": {
        "mix_execution_ledger": "21353740ee1e3543945cb7fbfd4ddd3d1d4f02a54506d202959408c02666a96a",
        "mixscore": "701eaa57aa48041ea17c99b52ceda202b79a70b82ae13f68cada2e1a2659b1cd",
        "score_extraction": "dfa85df39198afd6ff56fc0403d9f0c26a1b0fcfaea62d4f1d3fbc5e8691f219",
        "score_midi": "7d7342ef9d60228be4f94464764edf293b2052f6667676cdaf137a1dc94655c9",
        "score_proof_receipt": "e62bdbd86a6c7e4582169d14a83f3809c06d6fda10d798bd94ab46eb453248e6"
      },
      "main_refs": [
        "proofs/specimens/children_v1.score-side.proof.json"
      ],
      "retained_claims": [
        "69 printed measures",
        "105 performed measures",
        "1257 notes",
        "36 printed chord symbols",
        "53 performed HarmonyFrames",
        "19 of 19 MixScore operations executed",
        "0 refused",
        "0.0 stem reconciliation"
      ],
      "status": "main_contract_external_artifacts",
      "title": "Children score reconstruction and two-deck proof pack",
      "why_not_main": "The exact PDF, MIDI, WAVs, and compact pack are external; main retains their identities, adapters, schemas, and score-side proof."
    },
    {
      "boundary": "Target recording bytes and the cephalopod were not used; the repository importer does not claim to have independently reexecuted the report.",
      "evidence_id": "flim.community_symbolic_pack",
      "evidence_tier": "community_symbolic_witness",
      "main_refs": [
        "specimens/flim_bad_plus_v1.json",
        "specimens/flim_bad_plus_v1.community-symbolic.json"
      ],
      "proof_pack_sha256": "a7dabd71af884a4933b7e3c8077bc9d5e7b2e69de3fa9d370fd8b592d09cdf52",
      "retained_claims": [
        "56 bars and 224 beats",
        "2012 witness note-ons",
        "538 continuation note-ons",
        "six transport operations",
        "0.0 reported stem reconciliation"
      ],
      "status": "external_evidence_bound_by_identity",
      "title": "The Bad Plus — Flim community-symbolic witness and continuation",
      "why_not_main": "The media-rich compact pack stays external; main keeps the exact pack identity and evidence-tier report."
    },
    {
      "boundary": "The proof records reference-derived unique audio, publication_eligible=false, and publication_ok=false. Its local thesis flag is not whole-Buffalo passage.",
      "evidence_id": "pretty_lights.first30_reader_proof",
      "evidence_tier": "blind_audio_inference_with_reference_derived_execution",
      "main_refs": [
        "proofs/song_reader/pretty_lights_first30.proof.json"
      ],
      "source_sha256": "af3116da67067e2ce2d8f1635471388c371641f63687917948e154c289cef979",
      "status": "source_free_proof_landed_main",
      "title": "Pretty Lights first-30-second cephalopod proof"
    },
    {
      "evidence_id": "pretty_lights.full_recording_blind_report",
      "evidence_tier": "blind_audio_inference",
      "reopen_condition": "Bind the exact external pack or rerun from the exact source SHA and issue a current specimen receipt.",
      "retained_claims": [
        "full recording analyzed in five contiguous windows",
        "non-overlapping recurrence families",
        "complementary source-derived deck roles",
        "independent jump, loop, fade, cut, and relaunch execution",
        "exact master/stem reconciliation"
      ],
      "source_sha256": "af3116da67067e2ce2d8f1635471388c371641f63687917948e154c289cef979",
      "status": "conversation_report_unbound_to_main",
      "title": "Full-recording blind recurrence/deck proof reported in project sessions",
      "why_not_main": "The full proof pack and ledgers were session artifacts and were not imported as a repository specimen. Main contains only the source-free first-30-second reader proof and release-candidate fixture."
    },
    {
      "evidence_id": "pretty_lights.release_candidate_reported_v3",
      "evidence_tier": "performance_realization",
      "reopen_condition": "Import the exact b82e… pack and compare its PCM, edit plan, and receipt against the main v1 fixture.",
      "reported_claims": [
        "31.27 seconds",
        "35 ms equal-power transition",
        "-9.1 LUFS",
        "-0.5 dBFS true peak",
        "0.966 hook-reprise chroma",
        "human musical acceptance pending"
      ],
      "reported_pack_sha256": "b82e8895ab938c651d82da03233a6a8efc6aec8c2eb1b5004ba813071432f4a7",
      "status": "unresolved_external_revision",
      "title": "Reported Empire State recurrence release candidate v3",
      "why_not_main": "The reported pack was not available during repository reconciliation, and its identity differs from the committed v1 fixture. No supersession relationship is proven."
    },
    {
      "boundary": "Release remains blocked: human musical acceptance pending, rights not evaluated, transition integrity provisional.",
      "candidate_pcm_sha256": "5da1bef8526576ca49628de636337e8fe9e100b4e0da7ada0605d164a4298e59",
      "evidence_id": "pretty_lights.release_candidate_main_v1",
      "evidence_tier": "performance_realization",
      "external_proof_pack_sha256": "97bd2d4c3e7a38097956e2000db475e714c7fad67b51782b2905aeecfd8d0f9e",
      "main_refs": [
        "proofs/specimens/pretty_lights_empire_release_candidate_v1/proof.json",
        "proofs/specimens/pretty_lights_empire_release_candidate_v1/receipt.json"
      ],
      "retained_claims": [
        "31.261 seconds",
        "35 ms transition",
        "-9.0193 LUFS",
        "-0.5 dBFS true peak",
        "0.992983 chroma similarity",
        "two bit-exact builds"
      ],
      "status": "main_contract_external_pack",
      "title": "Committed source-free Empire State release-candidate fixture"
    },
    {
      "evidence_id": "session.listening_and_proof_artifacts",
      "evidence_tier": "various",
      "retained_rule": "Do not infer persistence from a past sandbox link.",
      "status": "ephemeral_unless_content_addressed_elsewhere",